{
  "boundaries_carried_forward": [
    "bounded_four_domain_single_capability_evaluation_only",
    "authoritative_live_complete_means_complete_only_within_declared_test_set",
    "universal_confidence_1_0_is_projection_fidelity_not_enterprise_readiness",
    "cross_domain_correlation_quality_not_demonstrated",
    "comparison_only_no_report_distribution_scheduling_deployment_or_production_authority"
  ],
  "candidate_hash": "sha256:ea730d2b8cea2978c38d99d3702c1d5cbb6cd01c461ac1a5286e0a1eed47b964",
  "candidate_id": "ca22ea90-b911-565a-931f-9a6f39ca265c",
  "decision_authority": "derived_from_project_owner_finalization",
  "deployment_effect": "none",
  "derived_at": "2026-08-02T18:01:00Z",
  "disposition_hash": "sha256:69713a8953b030d10e00cf3acb2e5c529c2c342d4c7492084000cc8cc5c16f45",
  "disposition_id": "ab66b8e5-373c-58cb-80b1-ec42681fe84d",
  "effect": "enterprise_shadow_integration_evaluation_eligibility_only",
  "eligibility_id": "9962a86c-2a44-5d8d-b13c-65e3c1428096",
  "ent_synth_scheduled": false,
  "finalization_hash": "sha256:eabfd1162de0789a55d60f4252af8d31b192e321a5f29f813d6503d3cc6cd852",
  "finalization_id": "36f3d8dd-eaba-5330-b09e-0552974d831e",
  "packet_hash": "sha256:af22b414a826d87466216b9a518e311b4c78dfddbd82709b96169301291b0ed5",
  "packet_id": "622d3763-f624-5264-8465-7ae347e6af6c",
  "reason": "project_owner_accepted_semantically_faithful_for_bounded_integration_evaluation",
  "record_hash": "sha256:bd72d0db1b13adf1c1ef8df056e63b6c11011b466a279fe1a37a26efc6a6742d",
  "report_effect": "none",
  "rollback_state": "active",
  "state": "eligible_for_enterprise_shadow_integration_evaluation"
}
